{
  "schema_version": "1.0.0",
  "snapshot_id": "55555555-5555-4555-8555-555555555555",
  "created_at": "2026-07-20T17:00:00Z",
  "edition": "api_paid",
  "session_id": "session_starter_01",
  "space_id": "home_01",
  "world_revision": 12,
  "progression_phase": "early",
  "art_style": {
    "profile_id": "cozy_default",
    "base_concept": "cozy_cyber_pixel_2_5d",
    "profile_version": "1.0.0"
  },
  "player": {
    "player_id": "player_01",
    "location": { "chunk_id": "0_0", "x": 10.5, "y": 7.0 }
  },
  "companion": {
    "companion_id": "companion_aida",
    "mood": 0.7,
    "relationship": 0.48,
    "personality_revision": 1,
    "recent_dialogue_summary": "House confirmed; companion proud."
  },
  "world": {
    "space_type": "private_reality",
    "entity_count": 18,
    "known_entity_ids": ["cozy_house_01", "farm_plot_01", "path_01", "lamp_01", "lamp_02"],
    "starter_realm": true
  },
  "quests": {
    "active": [
      {
        "quest_id": "onboarding_first_home",
        "title": "First Light at Home",
        "status": "ready_to_turn_in",
        "objective_summary": "Return to AIda to finish the onboarding quest."
      }
    ],
    "completed_ids": []
  },
  "latest_player_action": {
    "action_type": "interact",
    "occurred_at": "2026-07-20T16:59:40Z",
    "summary": "Player interacted with cozy_house_01 after materialize complete.",
    "target_entity_id": "cozy_house_01"
  },
  "last_execution_receipt": {
    "decision_id": "33333333-3333-4333-8333-333333333333",
    "status": "applied",
    "executed_at": "2026-07-20T16:10:00Z",
    "notes": "Build proposal queued; player confirmed and World Commit succeeded."
  },
  "memory": {
    "recent_turns": [
      { "role": "companion", "text": "It looks solid now. How does it feel?" },
      { "role": "player", "text": "Cozy. Let's finish the quest." }
    ],
    "summary": "House committed; onboarding quest ready to turn in."
  },
  "trace_id": "trace_snap_mid_01"
}
